Name,Address,Year,Keywords,Latitude,Longitude,Belongs_to_Berlin,matched_styles,matched_types
Botschaft der UDSSR,Berlin Bezirk Mitte Mitte Unter den Linden63-65,1948–1951,Rokoko Sozialistischen Klassizismus Glasmosaiken Attika Ehrenhof Laterne rustifizierten Botschaft,52.519444,13.406667,True,Barock/Rokoko - Rokoko,
Stadtplanung Lichtenberg,Berlin Bezirk Lichtenberg Landsberger Allee;Rheinstraße,1995,"Ensemble Stadtplanung Wohnanlage Raumbildung Raumkanten Raumfluchten Wasserfläche Wettbewerb, 1. Preis",52.5350334,13.5123403,True,,Öffentliche Gebäude - Stadtplanung
Haus Nolde,Berlin Bezirk Steglitz-Zehlendorf Dahlem,1929,Außenraumbezug Einfamilienhaus,52.4582353,13.2870827,True,,Wohngebäude - Einfamilienhaus
Volkskaffeehaus,Berlin Bezirk Mitte Mitte Neue Schönhauser Straße13,1890–1891,Café Neorenaissance,52.524595,13.4048225,True,Renaissance - Renaissance,
Müllverlade-Bahnhof,Berlin Bezirk Charlottenburg-Wilmersdorf Charlottenburg Helmholtzstraße42,1934–1937,Stromlinienform Technikgebäude Lage: Hafen,52.5214159,13.3196991,True,,Öffentliche Gebäude - Technikgebäude
Haus Perls (Galerie Fuchs),Berlin Bezirk Steglitz-Zehlendorf Zehlendorf Hermannstraße14,1911–1912,Einfamilienhaus Frühwerk Solitär Walmdach,52.43507719999999,13.2604251,True,,Wohngebäude - Einfamilienhaus
Stadtbad Kreuzberg (Baerwaldbad),Berlin Bezirk Friedrichshain-Kreuzberg Kreuzberg Baerwaldstraße64-67,1896–1901,Hallenbad Denkmalschutz rustizierten Tonnengewölbe Badeanlage Hallenbad Neorenaissance,52.4944472,13.4045266,True,Renaissance - Renaissance,Industriegebäude - Halle
Villa Urban,Berlin Bezirk Charlottenburg-Wilmersdorf Westend Ulmenallee32; Eschenallee 12,1911–1912,Einfamilienhaus Villa,52.517029,13.2685581,True,,Wohngebäude - Einfamilienhaus
Interbau-Bauteil (Wohnhaus),Berlin Bezirk Mitte Hansaviertel(Südliches Hansaviertel) Hanseatenweg1/3,1958,IBA 1957 (Interbau) Mehrfamilienhaus,52.5213115,13.3433225,True,,Wohngebäude - Einfamilienhaus
Börse,Berlin Bezirk Mitte Mitte Bodestraße,1859–1863,Börse Spätklassizismus,52.519867,13.3987393,True,Klassizismus - Klassizismus,
Tierpark Berlin,Berlin Bezirk Lichtenberg Friedrichsfelde Am Tierpark125 Berlin Bezirk Lichtenberg Friedrichsfelde Am Tierpark125 Berlin Bezirk Lichtenberg Friedrichsfelde Am Tierpark125,1954–1964,zoologischen Gärten Landschaftsgarten Landschaftspark stuckierte Gutshäusern Denkmalschutz Landschaftspark Mosaiken Zoos Zoo,52.50965619999999,13.5189846,True,,Gewächshäuser und Gärten - Zoo
Alexanderhaus,Berlin Bezirk Mitte Mitte Alexanderplatz2,1929–1932,Bürogebäude Geschäftshaus Lage: Platz Fassadenraster,52.519444,13.406667,True,,Öffentliche Gebäude - Palast
Lehr- und Forschungsgebäude Universitätsklinikum Berlin-Wedding,Berlin Bezirk Mitte Wedding Föhrer Straße,1987–1995,"Achse Atrium Decke, abgehängt dreihüftig Erweiterung Form: Halbkreis Forschungsgebäude Innenhof Krankenhaus Labor Oberlicht Symmetrie Technischer Ausbau Universitätsgebäude zweihüftig Form: Ellipse Luftraum Allee",52.5407948,13.3474533,True,,Öffentliche Gebäude - Regierungsgebäude
Schwedische Botschaft,Berlin Bezirk Mitte Tiergarten Stülerstraße3-5;Rauchstraße1,,Botschaft,52.5087494,13.348858,True,,
Geschichtspark »Ehemaliges Zellengefängnis Moabit«,Berlin Bezirk Mitte Moabit Invalidenstraße54,2003–2006,denkmalgeschützten Sandsteins Ortbeton Sichtbetonwerk Gefängnis Park Gedenkstätte Spielplatz,52.5257301,13.3655571,True,,Öffentliche Gebäude - Gefängnis
Siemens-Häuser Ringsiedlung,Berlin Bezirk Charlottenburg-Wilmersdorf Charlottenburg-Nord(Großsiedlung Siemensstadt) Jungfernheideweg; Mäckeritzstraße,1929–1931,Balkon Garten Siemensstadt Wohnanlage Zeile,52.5369936,13.2718829,True,,Wohngebäude - Gartenhaus
Erweiterung Reichshauptbankgebäude,Berlin,1933,Bankgebäude Wettbewerb,52.52000659999999,13.404954,True,,Öffentliche Gebäude - Sanitärgebäude
Französische Botschaft,Berlin Bezirk Mitte Mitte Pariser Platz5,5.1997,Traufhöhe Botschaft Lage: Platz Wettbewerb,52.5169799,13.379195,True,,Öffentliche Gebäude - Palast
Kathreiner-Hochhaus,Berlin Bezirk Tempelhof-Schöneberg Schöneberg Potsdamer Straße186,1928–1930,denkmalgeschütztes Travertin barocken Fensterband Geschosswohnung Hochhaus Internationaler Stil Mehrfamilienhaus Baustil,52.4981671,13.3621958,True,Barock/Rokoko - Barock,Wohngebäude - Einfamilienhaus
»Kupferhaus«,Berlin Bezirk Spandau Kladow Kurpromenade55 Berlin Bezirk Spandau Gatow Kladower Damm 182 Berlin Bezirk Pankow Niederschönhausen Klothildestraße 15 Berlin Bezirk Steglitz-Zehlendorf Lichterfelde(West) Curtiusstraße 77 Berlin Bezirk Steglitz-Zehlendorf Dahlem Schorlemerallee16 Berlin Bezirk Marzahn-Hellersdorf Biesdorf Köpenicker Straße223 Berlin Bezirk Charlottenburg-Wilmersdorf Westend Waldschulallee75 Berlin Bezirk Treptow-Köpenick Rahnsdorf(Hessenwinkel) Ahornstraße 19 Berlin Bezirk Treptow-Köpenick Rahnsdorf Springeberger Weg 10 Berlin Bezirk Treptow-Köpenick Rahnsdorf Springeberger Weg 8 Berlin Bezirk Treptow-Köpenick Müggelheim Ludwigshöheweg 40 Berlin Bezirk Reinickendorf Frohnau Alemannenstraße16 Berlin Bezirk Reinickendorf Frohnau Jostweg 13 Berlin Bezirk Reinickendorf Konradshöhe Rohrweihstraße 21 Brandenburg Cottbus Schmellwitz Schulstraße 4 Brandenburg Potsdam Nördliche Ortsteile Marquardt(Marquardt-Siedlung) Fährweg 7; Kohlmeisenweg Brandenburg Landkreis Barnim Eberswalde Finow Altenhofer Straße 2 Brandenburg Landkreis Barnim Eberswalde Finow Altenhofer Straße 41 Brandenburg Landkreis Barnim Eberswalde Finow Altenhofer Straße 42 Brandenburg Landkreis Barnim Eberswalde Finow Altenhofer Straße 43 Brandenburg Landkreis Barnim Eberswalde Finow Altenhofer Straße 44 Brandenburg Landkreis Barnim Eberswalde Finow Altenhofer Straße 45 Brandenburg Landkreis Barnim Eberswalde Finow Altenhofer Straße 46 Brandenburg Landkreis Barnim Eberswalde Finow Altenhofer Straße 47 Brandenburg Landkreis Barnim Eberswalde Finow Altenhofer Straße 48 Brandenburg Landkreis Barnim Wandlitz Seebadkorso 5 (Seebadcorso 35) Brandenburg Landkreis Potsdam-Mittelmark Michendorf Wilhelmshorst Rosenweg 32 Brandenburg Landkreis Dahme-Spreewald Zeuthen Forstweg 49 Brandenburg Landkreis Dahme-Spreewald Zeuthen Niemöllerstraße 10 Brandenburg Landkreis Dahme-Spreewald Zeuthen Stedinger Straße 21 Brandenburg Landkreis Havelland Nauen Goetheweg 44 Brandenburg Landkreis Oberhavel Oranienburg Lehnitz Florastraße 28 Brandenburg Landkreis Oberhavel Oranienburg Lehnitz Uferpromenade Brandenburg Landkreis Oberhavel Mühlenbecker Land Schildow Hermsdorfer Straße 85 Mecklenburg-Vorpommern Landkreis Vorpommern-Rügen Dierhagen Neuhaus an der Ostsee Hagebuttenweg 5 Rheinland-Pfalz Landkreis Neuwied Dierdorf Wied-Runkel-Straße 1 Sachsen-Anhalt Salzlandkreis Schönebeck/Elbe Am Röhrenstieg 1 Nordbezirk Safed(Canaan) Ha-Rabi mi-Lubavitch Street Haifa (Bezirk) Haifa(Ahuza) Tel Mana Street 20 Haifa (Bezirk) Haifa Merkaz HaCarmel (מרכז הכרמל) Ha-Hursha Street 9 Haifa (Bezirk) Haifa Merkaz HaCarmel (מרכז הכרמל) Leonardo da Vinci Street,1930–1934,Fertighaussystems Neuen Bauens Eternit Aluminiumfolie Denkmalschutz 1-geschossig 2-geschossig Dachdeckung: Kupferblech Einfamilienhaus Fertighaus Fertigteil Satteldach Wohnanlage Vorfertigung Blechfassade aus Kupfer Wandverkleidung aus Stahl Wandverkleidung aus Aluminium,52.4679751,13.1188509,True,,Wohngebäude - Einfamilienhaus
Grand Hyatt Hotel und Bürogebäude,Berlin Bezirk Mitte Tiergarten Marlene-Dietrich-Platz2,1993–1996,Bürogebäude Hotel Lage: Platz,52.514534,13.3501015,True,,Öffentliche Gebäude - Palast
Kroll-Oper und Festsaal,Berlin Bezirk Mitte Tiergarten Platz der Republik7,1920–1923,Opernhaus Fassadengestaltung Rokoko Oper Saalbau,52.51861090000001,13.3751713,True,Barock/Rokoko - Rokoko,Öffentliche Gebäude - Saalbau
Dorfkirche Tempelhof,Berlin Bezirk Tempelhof-Schöneberg Tempelhof(Alt-Tempelhof) Parkstraße5; Reinhardtplatz,Mitte 13. Jahrhundert,Tempelritter Tochterkirchen Johanniterorden patrozinium Liturgie Katharinenaltars Denkmalschutzes Denkmalpflege Dachreiters Kirche Spätromanik Saalkirche Glaubensrichtung: Templerorden Sankt Katharina,52.4642992,13.3838066,True,Mittelalter - Romanik,Denkmalschutz - Denkmalschutz
Kino Babylon und Wohnbauten,Berlin Bezirk Mitte Mitte Rosa-Luxemburg-Straße30,1927–1929,Kino denkmalgeschützten verputzt Foyer Stuck Kino Mehrfamilienhaus,52.5261054,13.4118096,True,,Wohngebäude - Einfamilienhaus
Landesvertretung Niedersachsen/Schleswig-Holstein,Berlin Bezirk Mitte Mitte In den Ministergärten8/10,1997–ca. 2000,"Auslandsvertretung Regierungsgebäude Wettbewerb, 1. Preis",52.512502,13.3782387,True,,Öffentliche Gebäude - Auslandsvertretung
Zigarettenfabrik Gárbaty,Berlin Bezirk Pankow Pankow Berliner Straße123-124;Hadlichstraße44,1906,Industriebau Fabrik Mauerwerk aus Ziegel,52.56955970000001,13.4131639,True,,Industriegebäude - Industriebau
Wohnblock Havelspitze,Berlin Bezirk Spandau Hakenfelde(Wasserstadt Oberhavel),1996–1997,Block Lage: Fluß Mehrfamilienhaus,52.5803789,13.1729486,True,Barock/Rokoko - Barock,Wohngebäude - Einfamilienhaus
Magnushaus,Berlin Bezirk Mitte Mitte Am Kupfergraben7,ca. 1753–ca. 1754,denkmalgeschütztes Bauensemble Walmdach Restauration Pilaster risalitartig Freitreppe Museumsinsel Wohnhaus Rokoko Spätbarock Denkmalgeschütztes Gebäude,52.5198346,13.3956878,True,Barock/Rokoko - Barock,Öffentliche Gebäude - Palast
Dorfkirche Mariendorf,Berlin Bezirk Tempelhof-Schöneberg Mariendorf Alt-Mariendorf 37,ca. 1230,Tempelritter Kreuzgratgewölbe Stichkappen barocken Sanierungsbedarf Kirche Spätromanik Saalkirche,52.4394822,13.3870859,True,Mittelalter - Romanik,
Umbau des Bodemuseums,Berlin Bezirk Mitte Mitte Bodestraße1-3,ab 1997,Denkmalpflege Museum für Kunst Umbau Berliner Museumsinsel,52.519444,13.406667,True,,Öffentliche Gebäude - Mausoleum
Reichsministerium für Volksaufklärung und Propaganda,Berlin Bezirk Mitte Mitte Wilhelmstraße,1934–1940,Regierungsgebäude,52.5115125,13.3833955,True,,Öffentliche Gebäude - Regierungsgebäude
Körperbehindertenschule Berlin-Lichtenberg,Berlin Bezirk Lichtenberg,1975–1977,Schule,52.53359039999999,13.4998575,True,,
Gleichrichterwerk Gesundbrunnen,Berlin Bezirk Mitte Gesundbrunnen Böttgerstraße 14,1927–1928,Umspannstation S-Bahnverkehr Mauerwerk aus Ziegel,52.5489729,13.3805007,True,,
Stadtküche Kraft,Berlin Tauentzienstraße,ca. 1928,Beleuchtung Blockrandbebauung Fensterband Geschäftshaus Internationaler Stil Lage: Stadt Umbau Werbung Fassadengestaltung,52.5031959,13.3388313,True,Moderne - Internationaler Stil,Öffentliche Gebäude - Altstadt
Hofgärtner- und Dampfmaschinenhaus im Volkspark Klein-Glienicke,Berlin Bezirk Steglitz-Zehlendorf Wannsee Park Glienicke,1836–1838,Lage: Park Technikgebäude Historismus,52.414223,13.093141,True,Historismus - Historismus,Öffentliche Gebäude - Technikgebäude
Schulgruppe Nöldnerplatz,Berlin Bezirk Lichtenberg Rummelsburg Fischerstraße 36; Schlichtallee; Nöldnerplatz,1927–1932,Aula Betonkonstruktion Ensemble Mauerwerksfassade aus Ziegel Raster Schule Form: Linse,52.5002912,13.4876098,True,,
Hochschulstadt Berlin,Berlin,1938,Wettbewerb,52.52000659999999,13.404954,True,,
Ringbrunnen auf dem Straußberger Platz,Berlin Bezirk Friedrichshain-Kreuzberg Friedrichshain Straußberger Platz,1966–1967,Brunnen,52.5182244,13.4279517,True,,
Pariser Platz,Berlin Bezirk Mitte Mitte Pariser Platz,,barocken Stadtpalais Wiederaufbau Allgemein Lage: Stadtzentrum Platz,52.5162038,13.3782795,True,Barock/Rokoko - Barock,Öffentliche Gebäude - Palast
Interbau-Bauteil (Wohnhausgruppe),Berlin Bezirk Mitte Hansaviertel(Südliches Hansaviertel) Händelallee55/57,1957,IBA 1957 (Interbau) Mehrfamilienhaus,52.5213115,13.3433225,True,,Wohngebäude - Einfamilienhaus
Wohnblock Havelspitze,Berlin Bezirk Spandau Hakenfelde(Wasserstadt Oberhavel),1996–1997,Block Lage: Fluß Mehrfamilienhaus,52.5803789,13.1729486,True,Barock/Rokoko - Barock,Wohngebäude - Einfamilienhaus
Cines-Kino,Berlin Bezirk Tempelhof-Schöneberg Schöneberg Nollendorfplatz,1912–1913,Expressionismus Kino,52.499333,13.3533905,True,Moderne - Expressionismus,
Niedrigenergiehaus,Berlin Bezirk Marzahn-Hellersdorf Marzahn Flämingstraße; Wittenberger Straße,ca. 1995–1997,Geschosswohnung Mehrfamilienhaus Niedrigenergie,52.5655238,13.5650012,True,,Wohngebäude - Einfamilienhaus
Zwietusch-Werk,Berlin Bezirk Charlottenburg-Wilmersdorf Charlottenburg Salzufer 6-7,1923–1926,"Bürogebäude Eckhaus Industriebau Mauerwerksfassade aus Ziegel Skelettbau aus Beton Ecke, spitzwinklig Staffelgeschoss",52.5163007,13.3279254,True,,Industriegebäude - Industriebau
U-Bahnhof Podbielskiallee,Berlin Bezirk Steglitz-Zehlendorf Dahlem Podbielskiallee,1911–1913,giebeln Sandstein Tonnenform Bahnstation U-Bahnverkehr,52.4647775,13.2962129,True,,
Hotel Four Seasons,Berlin Bezirk Mitte Mitte Charlottenstraße49,1996,Travertin Block Blockrandbebauung Hotel Innenhof Lochfassade Steinplattenfassade,52.5153632,13.3907914,True,Barock/Rokoko - Barock,
Wohnbauten in Berlin-Siemensstadt (Ringsiedlung),Berlin Bezirk Charlottenburg-Wilmersdorf Charlottenburg-Nord(Großsiedlung Siemensstadt) Heckerdamm,,Geschosswohnung Mehrfamilienhaus Siemensstadt Zeile,52.5413766,13.2762186,True,,Wohngebäude - Einfamilienhaus
Mauerpark,Berlin Bezirk Pankow Prenzlauer Berg Schwedter Straße,ca. 1990,"Amphitheater Kopfbahnhof Freiluftschule Außenraumgestaltung Geschichtsbezug Grünplanung Park Stadtplanung Wettbewerb, 1. Preis",52.5406122,13.4046025,True,,Öffentliche Gebäude - Stadtplanung
Handelsvertretung der UdSSR,Berlin,1951–1953,Bürogebäude,52.52000659999999,13.404954,True,,
»Axel Springer«-Passage,Berlin Bezirk Friedrichshain-Kreuzberg Kreuzberg Rudi-Dutschke-Straße4/6/8;Markgrafenstraße19a/20;Zimmerstraße28/30/32,bis 2004,denkmalgeschützten Innenhöfen Atrien Einkaufszentrum Geschäfte Glasfassade Mischnutzung Passage,52.5069552,13.3943813,True,,Freizeiteinrichtungen - Passage
Treptowers,Berlin Bezirk Treptow-Köpenick Alt-Treptow An den Treptowers 3,1993,Hochhaus Fassade Bürogebäude Hochhaus Fassadenraster Wettbewerb 31-geschossig Baustil Moderne,52.4955213,13.4615135,True,Moderne - Postmoderne,Freizeiteinrichtungen - Passage
Haus Gericke,Berlin Bezirk Steglitz-Zehlendorf Wannsee,1930–1932,"Außenraumbezug Einfamilienhaus Flachdach Hanglage, leicht Wettbewerb 1,5-geschossig",52.415113,13.1468678,True,,Wohngebäude - Einfamilienhaus
Haus Sommer,Berlin Bezirk Mitte Mitte Pariser Platz1,1996–1997,Ausstellungsgebäude Lage: Platz Rekonstruktion Sockel Steinplattenfassade aus Sandstein Symmetrie,52.5159037,13.3779998,True,,Öffentliche Gebäude - Palast
Autobahnüberbauung Schlangenbaderstraße,Berlin Bezirk Charlottenburg-Wilmersdorf Wilmersdorf Schlangenbaderstraße,1976–1980,Denkmalschutz Tiefgaragendecks Parkhaus Brückenbau Mehrfamilienhaus Tunnel Großkomplex,52.4730463,13.308134,True,,Wohngebäude - Einfamilienhaus
Apostolische Nuntiatur,Berlin Bezirk Neukölln Neukölln Lilienthalstraße 3A,ca. 2001–ca. 2002,Kapelle gotische Simon Petrus Auslandsvertretung Botschaft,52.488052,13.4083224,True,,Öffentliche Gebäude - Auslandsvertretung
Österreichische Botschaft,Berlin Bezirk Mitte Tiergarten Stauffenbergstraße1;Tiergartenstraße12-14,1996–1997,Stadtvillen Solitär Botschaft Wettbewerb,52.5096322,13.3637858,True,,
Haus Dr. Baensch,Berlin Bezirk Spandau Wilhelmstadt Höhenweg 9,1934–1935,villa modernista facciata giardino stile organico autorimessa facciata giardino superfici vetrate terrazza tetto soggiorno cucina sala da pranzo stanze da letto acciaio Außenraum Bebauungsplan Einfamilienhaus Essen Form: Fächer Garten Innenarchitektur Lage: Fluß Schiebetür Sofa Terrasse,52.5032982,13.1854644,True,Antike - Römische Architektur,Öffentliche Gebäude - Saalbau
Timoféeff-Ressovsky-Haus - Büro- und Laborgebäude für Genomforschung,Berlin Bezirk Pankow Buch Robert-Rössle-Straße 10,2005,Bürogebäude Labor,52.6274964,13.5018536,True,,
Grundschule Gatow,Berlin Bezirk Spandau Gatow Am Flugplatz Gatow 20,ca. 2000,Grundschule,52.47212270000001,13.1277336,True,,
Hochhaus an der Weberwiese,Berlin Bezirk Friedrichshain-Kreuzberg Friedrichshain Marchlewskistraße 25,1951–1952,Ziegelsteinen Dachterrasse laternenartiger Treppenhaus Hochhaus Moderne Fassaden funktionalistische Bauhauses Sozialistischen Klassizismus Fahrstuhl Hochhaus Baustil Moderne Aufzüge,52.5150977,13.4438333,True,Klassizismus - Klassizismus,
Realschule Glienicker Straße,Berlin Bezirk Treptow-Köpenick Köpenick Glienicker Straße 36,1995,Anbau Erweiterung Kubatur Mauerwerksfassade aus Ziegel Realschule Schule Sporthalle Symmetrie Wettbewerb,52.4396016,13.5659531,True,,Sonstige Gebäude - Sportanlage
Gleichrichterwerk Tegel,Berlin Bezirk Reinickendorf Tegel Buddestraße 20/28,1925–1926,Umspannstation S-Bahnverkehr Mauerwerk aus Ziegel,52.5904637,13.2874258,True,,
Strandbad Müggelsee,Berlin Bezirk Treptow-Köpenick Rahnsdorf Fürstenwalder Damm 838,1929–1930,Kindertagesstätte Badeanlage Betonkonstruktion Freibad Lage: See,52.4477015,13.6670781,True,,
Villa Nelson,Berlin Bezirk Charlottenburg-Wilmersdorf Westend Eichenallee 15,,Jugendstil Villa,52.5161014,13.2724209,True,Historismus - Jugendstil,
Komische Oper,Berlin Bezirk Mitte Mitte Behrenstraße55/57;Unter den Linden;Glinkastraße,1891–1892,Opernhaus Foyer neobarocken Giebel Oper Theater alt-neu,52.5159935,13.3868518,True,Barock/Rokoko - Barock,
Grand Hotel Esplanade,Berlin Bezirk Mitte Tiergarten Lützowufer15-19b,1986–1988,Hotel,52.5057193,13.3538838,True,,
Apostel-Johannes-Gemeindezentrum,Berlin Bezirk Reinickendorf Märkisches Viertel Dannenwalder Weg 167,1970–1971,Sichtbeton Brutalismus Denkmalschutz Gemeindezentrum Beton Hochhäuser Gebäudekomplex flachgedeckter skelettbau Sichtbeton Pfarrhaus Sheddächer Freitreppe Fassade Brutalismus Gemeindezentrum Glaubensrichtung: evangelisch Sichtbeton Pfarrkirche Sankt Johann,52.59576999999999,13.35979,True,Moderne - Brutalismus,Freizeiteinrichtungen - Passage
Südliche Friedrichsstadt Block 606,Berlin Bezirk Friedrichshain-Kreuzberg Kreuzberg,1983,"Blockrandbebauung Geschosswohnung IBA 1984 (Berlin) Mehrfamilienhaus Wohnanlage Wettbewerb, 1. Preis",52.4983442,13.4065791,True,,Wohngebäude - Einfamilienhaus
Wohnhaus für Walter Loebe,Berlin Bezirk Reinickendorf Waidmannslust Bondickstraße 7,1930,Einfamilienhaus,52.60496,13.3158598,True,,Wohngebäude - Einfamilienhaus
Grabmal Siegfried Hessel,Berlin,1918,Grabmal,52.52000659999999,13.404954,True,,
S-Bahnhof Wannsee,Berlin Bezirk Steglitz-Zehlendorf Wannsee Kronprinzessinnenweg,1927–1928,Gusseisensäulen Satteldach Stellwerke Bahnhöfen Oberlicht Dachlaterne verputzt Arkade Laubengang kuppelartige Satteldach Bahnhof Bahnstation S-Bahnverkehr Mauerwerk aus Ziegel,52.4279201,13.1855137,True,,Öffentliche Gebäude - Bauhof
TAZ »tageszeitung« Verlagsgebäude,Berlin Bezirk Friedrichshain-Kreuzberg Kreuzberg Rudi-Dutschke-Straße23 (Kochstraße19),1990–1991,Anbau Balkon Bürogebäude Ecke Erweiterung Verlagsgebäude,52.5069552,13.3943813,True,,Öffentliche Gebäude - Regierungsgebäude
Sankt-Albertus-Magnus-Kirche,Berlin Bezirk Charlottenburg-Wilmersdorf Halensee Nestorstraße 10,1960–1962,Denkmalschutz Kindergarten Kirchenpatrons Kindertagesstätte Satteldach Saalkirche Dachtraufe Taufkapelle Campanile Dachtraufe Lisenen Glasbausteine Krypta Pfarrkirche Campanile Stilelemente Filialkirche,52.4972498,13.2993914,True,,Denkmalschutz - Denkmalschutz
Vitra Design Museum Berlin,Berlin Bezirk Pankow Prenzlauer Berg Kopenhagener Straße58,ca. 2000,Museum für Design Umnutzung: Technikgebäude Ausstellung: Architektur,52.6064589,13.4837205,True,Antike - Römische Architektur,Öffentliche Gebäude - Technikgebäude
Haus Bejach,Berlin Bezirk Steglitz-Zehlendorf Wannsee(Steinstücken) Bernhard-Beyer-Straße 12,1926–1927,"Neuen Bauens Pergolen 2-geschossig Einfamilienhaus Fassade, gestreift",52.3892017,13.1291693,True,,Wohngebäude - Einfamilienhaus
Hauptverwaltungsgebäude GSW Wohnungsbaugesellschaft,Berlin Bezirk Friedrichshain-Kreuzberg Kreuzberg Rudi-Dutschke-Straße17 (Kochstraße22);Charlottenstraße4,1991,Bauensemble Vorhangfassade Mosaik Bürogebäude Eckhaus Erweiterung Hochhaus Ensemble Wettbewerb Form: Scheibe Renovierung Baustil Moderne High-Tech-Architektur,52.5067925,13.3935765,True,Historismus - Heimatschutzarchitektur,
Willy-Brandt-Haus (SPD-Zentrale),Berlin Bezirk Friedrichshain-Kreuzberg Kreuzberg Wilhelmstraße140-141,1993–1996,"Klassische Moderne Kalkstein Atrium Glasfront bronzene Atrium Cortenstahl Bürogebäude Eckhaus Geschäfte Ecke, spitzwinklig",52.5001701,13.3882297,True,Moderne - Postmoderne,
Haus Freudenberg,Berlin Bezirk Steglitz-Zehlendorf Nikolassee Potsdamer Chaussee48; Rehsprung,1907–1908,Denkmalschutz Walmdach Marmor Einfamilienhaus Lage: See,52.4245926,13.2026898,True,,Wohngebäude - Einfamilienhaus
Wohnhaus Dienstbach,Berlin Bezirk Steglitz-Zehlendorf Nikolassee Lohengrinstraße 32,1936,Einfamilienhaus,52.4219648,13.1924315,True,,Wohngebäude - Einfamilienhaus
Großes Schauspielhaus,Berlin Bezirk Mitte Mitte Am Zirkus,1918–1919,expressionistischer gusseiserne Stuckdecke Foyer Decke Expressionismus Gewölbe Innenarchitektur Saal Theater Umnutzung: Markthalle,52.5228704,13.3866813,True,Antike - Römische Architektur,Öffentliche Gebäude - Saalbau
Quartier Schützenstraße,Berlin Bezirk Mitte Mitte Schützenstraße;Markgrafenstraße;Zimmerstraße;Charlottenstraße,1995–1997,Bauensemble achteckiger denkmalgeschützte Neorenaissance Blockrandbebauung Farbigkeit Geschäfte Lochfassade Mehrfamilienhaus Mischnutzung Stadthaus Stadtplan Staffelgeschoss,52.5069594,13.3928392,True,Renaissance - Renaissance,Öffentliche Gebäude - Stadtplanung
Villa Collignon,Berlin Bezirk Steglitz-Zehlendorf Wannsee Am großen Wannsee74,1923–1926,Einfamilienhaus,52.4282757,13.1628914,True,,Wohngebäude - Einfamilienhaus
Portugiesische Botschaft,Berlin Bezirk Mitte Mitte Wilhelmstraße,ca. 1970,Botschaft,52.5115125,13.3833955,True,,
Masterplan »Band des Bundes«,Berlin Bezirk Mitte Tiergarten,,Solitärbau Regierungsgebäude Stadtplanung Linearität,52.514534,13.3501015,True,,Öffentliche Gebäude - Regierungsgebäude
Geheimes Civil-Cabinett des Kaisers,Berlin Bezirk Mitte Mitte Wilhelmstraße54,1900–1901,Denkmalschutz fassade neobarocke Bauschmuck,52.51358639999999,13.3826468,True,Barock/Rokoko - Barock,Freizeiteinrichtungen - Passage
Messegelände,Berlin Bezirk Charlottenburg-Wilmersdorf Westend Messedamm,1927–1930,Messegebäude,52.5035393,13.2781622,True,,
Künstlerhaus Sankt Lukas,Berlin Bezirk Charlottenburg-Wilmersdorf Charlottenburg Fasanenstraße13,1889–1890,Kulturzentrum Sankt Lukas,52.5049264,13.3274555,True,,
Wohnen »Am Karlsbad«,Berlin Bezirk Mitte Tiergarten Am Karlsbad6-7,1986–1987,Blockrandbebauung IBA 1984 (Berlin) Mehrfamilienhaus,52.514534,13.3501015,True,,Wohngebäude - Einfamilienhaus
Umformwerk Neukölln (Umspannwerk der U-Bahn),Berlin Bezirk Neukölln Neukölln Hermannstraße5-8,1927–1928,Technikgebäude Umspannstation Mauerwerk aus Ziegel,52.4856272,13.4236491,True,,Öffentliche Gebäude - Technikgebäude
Bilka-Warenhaus,Berlin Bezirk Charlottenburg-Wilmersdorf Charlottenburg Joachimsthaler Straße5-6,1956,Fassadenornamentik Kaufhaus,52.5542257,13.2461735,True,Moderne - Bauhaus,
Volkskaffeehaus,Berlin Bezirk Mitte Mitte Chausseestraße105,1892,Café,52.5318282,13.3810353,True,,
Stadtteilzentrum Hohenschönhausen,Berlin Bezirk Lichtenberg Alt-Hohenschönhausen Hauptstraße; Leuenberger Straße,bis 1997,"Bürogebäude Geschäftshaus Mischnutzung Parkhaus Wettbewerb, 1. Preis",52.5471106,13.5040687,True,,Gewächshäuser und Gärten - Gewächshaus
Informations-Pavillon am Leipziger Platz,Berlin Bezirk Mitte Mitte Leipziger Platz,ca. 1999,Ausstellungsarchitektur Pavillon,52.509605,13.3779332,True,Alternative/Regionale Stile - Anpassungsarchitektur,Freizeiteinrichtungen - Ausstellungsarchitektur
Hochbahnanlage »Magistratsschirm«,Berlin Bezirk Pankow Prenzlauer Berg Schönhauser Allee,1911–1913,Aufständerung Stahlkonstruktion U-Bahnverkehr Hochbahn,52.5415659,13.4123322,True,,
Elektro-Mechanik-Fabrik,Berlin Bezirk Steglitz-Zehlendorf Lankwitz Nicolaistraße7,1928,2-geschossig Fensterband Flachdach Fabrik,52.4446108,13.3342952,True,,
evangelische Dorfkirche Kaulsdorf,Berlin Bezirk Marzahn-Hellersdorf Kaulsdorf Dorfstraße,,Barock Neugotik Denkmalschutz Saalkirche barocker neogotischen Stil Zeltform neogotischen Kindertagesstätte abgewalmtes Satteldach gusseiserne ornamental barocke Emporen liturgischen Geräte neobarocken Kindergarten Kirche,52.508638,13.5796018,True,Mittelalter - Gotik,Industriegebäude - Silo
Österreichische Abteilung der »Reise- und Fremdenverkehrsausstellung«,Berlin,1911,,52.52000659999999,13.404954,True,,
Kapelle Sankt Michael in der Kurie des katholischen Militärbischofs,Berlin Bezirk Mitte Mitte Am Weidendamm 2,2001,Innenarchitektur Kapelle,52.5219217,13.3899111,True,Antike - Römische Architektur,
Kirche Sankt Marien am Behnitz,Berlin Bezirk Spandau Spandau Behnitz 9;Am Juliusturm,2002–2003,römisch-katholischen restauriert Denkmalschutz Dominikanerpater patrozinium Petrus OP Patrozinium Maria Fachwerkbau Normalkirche Basilika neugotische Fassade Kassettendecke marmorierten wimpergartigen Petrus Patrone Pfarrhaus Anna Empore Sanierung liturgisch Restaurierung Sandstein Basilika pilaster Fensterrose empore Gewölbe Maßwerk Ursula von Köln Laterne Anna Granit Augustinus Maria Franz von Assisi Kirche Glaubensrichtung: katholisch,52.5392071,13.2079296,True,Historismus - Neugotik,Öffentliche Gebäude - Palast
Amerika-Gedenkbibliothek,Berlin Bezirk Friedrichshain-Kreuzberg Kreuzberg Blücherplatz1,1951,Bibliothek,52.4983442,13.4065791,True,,
