Name,Address,Year,Keywords,Latitude,Longitude,Belongs_to_Berlin,matched_styles,matched_types
Oranienburger Tor,Berlin Bezirk Mitte Mitte Friedrichstraße118/119; Wilhelm-Pieck-Straße,1992,Geschäftshaus,52.519444,13.406667,True,,Gewächshäuser und Gärten - Gewächshaus
Hauptstadtvertretung des Caritasverbandes,Berlin Bezirk Mitte Mitte Reinhardtstraße13,2006,Bürogebäude,52.52341,13.3858041,True,,
Hauptbahnhof,Berlin Bezirk Mitte Tiergarten Invalidenstraße;Lehrter Straße,1993,Rolltreppen aufzüge Granit Parkhaus denkmalgeschützte Flachdecke Denkmalschutz Bahnhof Brückenbau Stadtplanung Umbau,52.5252314,13.3657007,True,,Öffentliche Gebäude - Stadtplanung
Umspannwerk Leibnizstraße,Berlin Bezirk Charlottenburg-Wilmersdorf Charlottenburg Leibnizstraße65;Leibnizstraße;Niebuhrstraße,1927–1928,"Um- und Abspannwerk Stahlskelettbauweise Sheddach 6-geschossig Mauerwerksfassade aus Ziegel Technikgebäude Umspannstation Ecke, abgerundet",52.5046372,13.313092,True,,Öffentliche Gebäude - Technikgebäude
Wohnanlage Malchower Weg,Berlin Bezirk Lichtenberg Alt-Hohenschönhausen Malchower Weg 117-119; Drossener Straße 1-4,1994,Stadtplanung Wohnanlage,52.5599664,13.5010633,True,,Öffentliche Gebäude - Stadtplanung
Pfarrkirche Sankt Georg,Berlin Bezirk Pankow Pankow Kissingenplatz,1907–1909,römisch-katholische Kirche Kirchenpatron Heilige The­resa von Avila Kirche Pfarrhaus Kapelle Gotteshauses neogotischer Glasbausteinen Kunststein Neogotik Wimperg Giebel Maßwerk Staffelgiebel Mosaik Denkmalschutz Kreuzrippengewölbe ornamentiert Sterngewölbe spätgotischen Empore Hedwig Täufers Johannes Taufkapelle Dreifaltigkeit Jesus Christus Immerjungfrau Maria Kindergarten Patronin Pfarrhaus Kirche Pfarrkirche Sankt Georg,52.56779,13.4211007,True,Mittelalter - Gotik,Denkmalschutz - Denkmalschutz
Geschäftshaus,Berlin Bezirk Tempelhof-Schöneberg Schöneberg Kleiststraße,ca. 1960,,52.5006967,13.348798,True,,
Freizeit- und Erholungs-Zentrum FEZ,Berlin Bezirk Treptow-Köpenick Köpenick An der Wuhlheide,1976–1979,Außenraumbezug Foyer Hallenbad Lage: Park Saalbau Veranstaltung Freizeitanlage,52.4558212,13.5570622,True,,Öffentliche Gebäude - Saalbau
Wohnbebauung am Luisenplatz,Berlin Bezirk Charlottenburg-Wilmersdorf Charlottenburg Charlottenburger Ufer1; Eosanderstraße 18; Eosanderstraße 21;Otto-Suhr-Allee144;Luisenplatz,1983–1987,"Solitär Anbau Flügeldach Fassadenschichtung Geschosswohnung IBA 1984 (Berlin) Lage: Platz Mauerwerksfassade aus Ziegel Mehrfamilienhaus Verglasung Wintergarten Wohnanlage abgelöstes Dach Wettbewerb, 1. Preis",52.5200768,13.3031531,True,,Öffentliche Gebäude - Palast
Haus Matthes,Berlin Bezirk Steglitz-Zehlendorf Dahlem Am Hirschsprung 63,1973–1974,Flachdach Geschosswohnung Mehrfamilienhaus Skelettbau aus Beton Solitär,52.46765079999999,13.2810358,True,,Wohngebäude - Einfamilienhaus
Haus Ernst Rading,Berlin Bezirk Steglitz-Zehlendorf Zehlendorf Sophie-Charlotte-Straße 42a,1928–1929,Einfamilienhaus Internationaler Stil,52.4460505,13.2653885,True,Moderne - Internationaler Stil,Wohngebäude - Einfamilienhaus
Rotes Rathaus,Berlin Bezirk Mitte Mitte Rathausstraße15-18,1861–1869,Ziegelfassade Granit Sanierung Fassaden risaliten Attika Pilaster Syenit Gusseisen Sandstein Wandbilder Restauration Block Mauerwerksfassade aus Ziegel Rathaus Turm Historismus Baustil,52.5184394,13.4068377,True,Barock/Rokoko - Barock,Öffentliche Gebäude - Turm
"Stadtvilla an der Rauchstraße, Haus 9",Berlin Bezirk Mitte Tiergarten Rauchstraße6,1983–1985,Form: Kubus IBA 1984 (Berlin) Lochfassade Mehrfamilienhaus Postmoderne Solitär,52.514534,13.3501015,True,Moderne - Postmoderne,Wohngebäude - Einfamilienhaus
Kino International,Berlin Bezirk Friedrichshain-Kreuzberg Friedrichshain Karl-Marx-Allee33 (Stalinallee33),ca. 1960,architektonischen Moderne Denkmalschutz Sozialistischen Klassizismus Plattenbauten Sandstein Atombunker Aufzug Aufständerung Glasfassade Kino Solitär Baustil,52.5182474,13.4367544,True,Klassizismus - Klassizismus,Denkmalschutz - Denkmalschutz
Wohnhochhaus auf der Interbau,Berlin Bezirk Mitte Hansaviertel(Südliches Hansaviertel) Bartningallee7,1959–1960,16-geschossig Betonkonstruktion Erschließung Hochhaus IBA 1957 (Interbau) Mehrfamilienhaus,52.5213115,13.3433225,True,,Wohngebäude - Einfamilienhaus
Verwaltung der Firma La Roche,Berlin,1936,Bürogebäude,52.52000659999999,13.404954,True,,
Umspannwerk Humboldt,Berlin Bezirk Pankow Prenzlauer Berg Kopenhagener Straße58–63; Sonnenburger Straße 69–75,1924–1926,Umspannwerks Backsteingotik Basilika Eckhaus Innenhof Mauerwerksfassade aus Ziegel Rotunde Technikgebäude Baustil,52.547618,13.4075423,True,,Öffentliche Gebäude - Technikgebäude
Zinnowwaldschule,Berlin Bezirk Steglitz-Zehlendorf Zehlendorf Wilskistraße78/80,1929–1932,Schule,52.4451221,13.2464701,True,,
debis-Hochhaus Spittelmarkt,Berlin Bezirk Mitte Mitte Spittelmarkt; Seydelstraße,,Bürogebäude Hochhaus,52.5113324,13.4017294,True,,
Warenhaus Held,Berlin Bezirk Tempelhof-Schöneberg Friedenau Bundesallee97-103; Walter-Schreiber-Platz,bis 1965,Erweiterung Kaufhaus,52.46614779999999,13.3282366,True,Moderne - Bauhaus,
Zentralinstitut für Herz-Kreislaufforschung (Franz-Vollhardt-Klinik),Berlin Bezirk Pankow Buch Alt-Buch,1954–1956,1-geschossig Arkadengang Innenhof Krankenhaus Organische Architektur Walmdach,52.6357183,13.5010639,True,Antike - Römische Architektur,
AEG-Montagehalle für Großmaschinen,Berlin Bezirk Mitte Gesundbrunnen Hussitenstraße,1912,Fabrik Mauerwerk aus Ziegel,52.5396305,13.3852793,True,,
Fußgängerstraße in Berlin-Gropiusstadt,Berlin Bezirk Neukölln Gropiusstadt,1963–1966,Straße Fußgängerverkehr Straßenraumgestaltung,52.42177909999999,13.4616071,True,,
Institut für Meteorologie der Freien Universität Berlin,Berlin Bezirk Steglitz-Zehlendorf Steglitz Carl-Heinrich-Becker-Weg6-10,1978–1990,Erweiterung Universitätsgebäude,52.4530959,13.3311709,True,,
Finnische Botschaft,Berlin Bezirk Mitte Tiergarten Rauchstraße1;Klingelhöferstraße,1999,Botschaft,52.5077386,13.3517493,True,,
Vier Stadtvillen,Berlin Bezirk Mitte Tiergarten Rauchstraße19-20,1978–1982,Eingang Garage IBA 1984 (Berlin) Innenhof Mehrfamilienhaus Solitär Terrasse,52.508633,13.3474774,True,,Wohngebäude - Einfamilienhaus
Palasthotel,Berlin Bezirk Mitte Mitte Karl-Liebknecht-Straße;Spandauer Straße,1976–1979,Restaurants Bars Café Hotel Lochfassade,52.5201646,13.4047944,True,,
Ludwig-Erhard-Haus,Berlin Bezirk Charlottenburg-Wilmersdorf Charlottenburg Fasanenstraße85,1991,"Atrien Abhängung Atrium Bogentragwerk Börse Bürogebäude Form: geschwungen Glasfassade Lichthof Wettbewerb, 1. Preis",52.5067659,13.3286276,True,,Öffentliche Gebäude - Schlachthof
Gardekasernen des Regiments »Garde du Corps«,Berlin Bezirk Charlottenburg-Wilmersdorf Charlottenburg Schloßstraße1 Berlin Bezirk Charlottenburg-Wilmersdorf Charlottenburg Schloßstraße70,1852–1859,Militärgebäude Symmetrie Kaserne,52.5026074,13.3380237,True,,Öffentliche Gebäude - Militärgebäude
Nikolaikirche,Berlin Bezirk Mitte Mitte Nikolaiviertel Nikolaikirchplatz;Poststraße,ca. 1230,Kirchengebäude Denkmalschutz Pfeilerbasilika frühgotische Nikolaus von Myra patrozinium frühgotische frühgotischen Kapellenanbau neugotische barocker Luthertum Reformierten Kirchenunion originalgetreu wiederaufgebaut Kreuzgewölbe Basilika Halle Hallenkirche Staffelgiebel historistischen gotisch barock Kreuzrippengewölbe Kirche Spätgotik Hallenkirche Sankt Nikolaus,52.5166825,13.4064736,True,Mittelalter - Gotik,Öffentliche Gebäude - Technikgebäude
Zirkusgebäude Nordbahnhof,Berlin Bezirk Mitte Mitte Invalidenstraße,1995,Halle Mischnutzung Veranstaltung Wettbewerb Zirkus,52.5300001,13.381097,True,,Freizeiteinrichtungen - Veranstaltung
Kaiser Wilhelm-Gedächtniskirche,Berlin Bezirk Charlottenburg-Wilmersdorf Charlottenburg Breitscheidplatz,1891–1895,Kirche Gedenkkirche,52.5047297,13.3352316,True,,
Beisheim Center - Ritz Carlton Tower,Berlin Bezirk Mitte Mitte Potsdamer Platz3,bis 2004,Art Déco Hochhaus Art Déco Wolkenkratzer Marmor mosaiken Decke Hochhaus Hotel Lage: Platz,52.5102754,13.3752548,True,,Öffentliche Gebäude - Palast
Kino »Sojus«,Berlin Bezirk Marzahn-Hellersdorf Marzahn Helene-Weigel-Platz12; Allee der Kosmonauten,1981,Fertigteil aus Beton Kino,52.531305,13.5473487,True,,
Institut für Physik der Humboldt Universität,Berlin Bezirk Treptow-Köpenick Adlershof Newtonstraße15,1998,Institut Universitätsgebäude Hochschule für Physik,52.4331501,13.5300092,True,,
Deutsches Architekturzentrum (DAZ),Berlin Bezirk Mitte Mitte Köpenicker Straße48-49,1995,Architekturzentrum Aufstockung Ausstellungsgebäude Bürogebäude Umbau Umnutzung Ausstellung: Architektur,52.50933999999999,13.42357,True,Antike - Römische Architektur,Freizeiteinrichtungen - Ausstellung
Reichstagsumbau,Berlin Bezirk Mitte Tiergarten Platz der Republik1,1989–1993,Parlamentsgebäude Regierungsgebäude Restaurierung Umbau Wettbewerb,52.518619,13.3763176,True,,Öffentliche Gebäude - Regierungsgebäude
Engelhardt-Hof,Berlin Bezirk Charlottenburg-Wilmersdorf Charlottenburg Danckelmannstraße 9,ca. 1995,Bürogebäude Geschäftshaus Mehrfamilienhaus,52.5160339,13.290471,True,,Wohngebäude - Einfamilienhaus
Parzelle im Carré am Gendarmenmarkt,Berlin Bezirk Mitte Mitte Markgrafenstraße34;Mohrenstraße45,1994–1996,Blockrandbebauung Mehrfamilienhaus,52.5124803,13.393781,True,,Wohngebäude - Einfamilienhaus
Appartementhaus,Berlin Bezirk Charlottenburg-Wilmersdorf Wilmersdorf Hohenzollerndamm35/36,1929–1930,facciate facciate finestrelle bagni soggiorno balconi Appartement Balkon Ecke Fassade Geschosswohnung Lichthof Mehrfamilienhaus Sockel,52.4904703,13.3144802,True,,Öffentliche Gebäude - Schlachthof
Landesvertretung von Nordrhein-Westfalen,Berlin Bezirk Mitte Tiergarten Hiroshimastraße12-16,bis 2002,Bürogebäude,52.5083491,13.3576801,True,,
Lapidarium,Berlin Bezirk Pankow Prenzlauer Berg Schönhauser Allee23-25,2004–6.2005,1-geschossig Flachdach Friedhofsgebäude Museum Pavillon,52.5343069,13.4130271,True,,Öffentliche Gebäude - Verkehrsgebäude
Deutsch-Japanisches Zentrum,Berlin Bezirk Mitte Tiergarten Hiroshimastraße6;Tiergartenstraße24-27,1988,Auslandsvertretung Botschaft Forschungsgebäude Innenhof Institut Umbau: Altbau alt-neu,52.5098262,13.3577826,True,,Öffentliche Gebäude - Auslandsvertretung
Bundestag der Bundesrepublik Deutschland,Berlin Bezirk Mitte Tiergarten Platz der Republik1,1994,"Bundestag Regierungsgebäude Umbau Reichstag Wettbewerb, 1. Preis",52.518619,13.3763176,True,,Öffentliche Gebäude - Regierungsgebäude
Kleinmotorenfabrik der AEG,Berlin Bezirk Mitte Gesundbrunnen Voltastraße,1910–1911,5-geschossig Industriebau Fabrik Mauerwerksfassade aus Ziegel Fassadengliederung Mauerwerkskonstruktion,52.5415427,13.3895747,True,,Industriegebäude - Industriebau
Masterplan Stadtvillen an der Rauchstraße,Berlin Bezirk Mitte Tiergarten Rauchstraße;Thomas-Dehler-Straße;Drakestraße;Stülerstraße,1983–1985,5-geschossig Mehrfamilienhaus Postmoderne Solitär Stadthaus Stadtplanung Wohnanlage,52.50865599999999,13.3485605,True,Moderne - Postmoderne,Öffentliche Gebäude - Stadtplanung
Wohnanlage,Berlin Bezirk Pankow Niederschönhausen Grabbealle 14-26; Paul-Franke-Straße,1908–1909,Wohnanlage,52.5731066,13.399668,True,,
DaimlerChrysler-Gebäude - Hochhaus am Potsdamer Platz - Kollhoff Tower,Berlin Bezirk Mitte Mitte Potsdamer Platz1,1998–2000,"Bürogebäude Hochhaus Lage: Platz Mauerwerksfassade aus Ziegel Ecke, spitzwinklig Baustil Moderne",52.5096836,13.3771223,True,Moderne - Postmoderne,Öffentliche Gebäude - Palast
IBA-Wohnungsbau (Wohnpark am Berlin Museum),Berlin Bezirk Friedrichshain-Kreuzberg Kreuzberg Lindenstraße15-19,1982–1986,Blockrandbebauung Geschosswohnung IBA 1984 (Berlin) Mehrfamilienhaus,52.5027786,13.3954384,True,,Wohngebäude - Einfamilienhaus
Sommerhaus für Jacob Tuteur,Berlin Bezirk Charlottenburg-Wilmersdorf Westend Havelchaussee28/30/32;Am Rupenhorn4,1924–1925,Einfamilienhaus,52.4857377,13.20056,True,,Wohngebäude - Einfamilienhaus
Ernst-Reuter-Haus,Berlin Bezirk Charlottenburg-Wilmersdorf Charlottenburg Straße des 17. Juni110/112/114,1938–1939,Bürogebäude Faschistische Architektur,52.5133394,13.3317915,True,Antike - Römische Architektur,
Verbandshaus der Deutschen Buchdrucker,Berlin Bezirk Friedrichshain-Kreuzberg Kreuzberg Dudenstraße10,1924–1926,"Fassadengliederung, horizontal Fassadengliederung, vertikal Hof Druckerei Ensemble Loggia Mauerwerksfassade aus Ziegel Skelettbau aus Beton Symmetrie Wohnhaus",52.4983442,13.4065791,True,,
Wohnhaus,Berlin Bezirk Charlottenburg-Wilmersdorf Charlottenburg Schustehrusstraße 13,1712,Wohnhaus,52.5171298,13.303791,True,,
Innovationszentrum für Photonik,Berlin Bezirk Treptow-Köpenick Adlershof Rudower Chaussee6,1995–1998,Farbigkeit Flachdach Form: amorph Forschungsgebäude Glasfassade Institut Universitätsgebäude Wettbewerb,52.4341431,13.5370351,True,,Öffentliche Gebäude - Regierungsgebäude
"Stadtvilla an der Rauchstraße, Haus 3",Berlin Bezirk Mitte Tiergarten Thomas-Dehler-Straße3,1982–1984,Form: Kubus IBA 1984 (Berlin) Lochfassade Mehrfamilienhaus Solitär,52.5094301,13.347862,True,,Wohngebäude - Einfamilienhaus
Montanwerke,Berlin,1938–1940,,52.52000659999999,13.404954,True,,
Sankt Benediktkirche und Gemeindezentrum,Berlin Bezirk Steglitz-Zehlendorf Lankwitz Kaulbachstraße62/6,1967–1968,römisch-katholische Denkmalschutz Gartenstadt Notkirche Benedikt Gemeindezentrums Flachdach Fassade Guss verputzt freistehende runde Kirchturm Sichtbetonringen Kalksandstein Kassettendecke liturgischer Pfarrhaus Kindertagesstätte Gemeindezentrum Kirche Glaubensrichtung: katholisch Sankt Benedikt,52.4396588,13.3416304,True,,Öffentliche Gebäude - Altstadt
Kleine Neugierde,Berlin Bezirk Steglitz-Zehlendorf Wannsee Königstraße,1796,Lage: Park Pavillon,52.4165516,13.1346899,True,,Freizeiteinrichtungen - Park
Plan für die Hauptstadt Berlin,Berlin,1957–1958,Brutalismus Ministerium Regierungsgebäude Schichtung Stadtplan Stadtplanung Utopie Verkehrsführung,52.52000659999999,13.404954,True,Moderne - Brutalismus,Öffentliche Gebäude - Regierungsgebäude
Volksbank-Center am Potsdamer Platz,Berlin Bezirk Mitte Tiergarten Schellingstraße1,ca. 2000,Bankgebäude Fassadenmuster Steinplattenfassade Fassadenraster,52.5056992,13.3734729,True,,Öffentliche Gebäude - Sanitärgebäude
Verwaltungsgebäude und Umformwerk der BVG,Berlin Bezirk Mitte Mitte Rosa-Luxemburg-Straße2;Rosa-Luxemburg-Straße@Dircksenstraße,1929–1930,"Bürogebäude Eckhaus Fassadengliederung, horizontal Umspannstation 6,5-geschossig",52.5231641,13.4093122,True,,
Wohnhaus Kantstraße,Berlin Bezirk Charlottenburg-Wilmersdorf Charlottenburg Kantstraße;Uhlandstraße,1996,Eckhaus Geschäftshaus Mehrfamilienhaus,52.5056956,13.3257586,True,,Wohngebäude - Einfamilienhaus
Amerika-Gedenkbibliothek,Berlin Bezirk Friedrichshain-Kreuzberg Kreuzberg Blücherplatz1,1952–1954,University of Virginia Bibliothek,52.4983442,13.4065791,True,,
Einfamilienhaus,Berlin Bezirk Charlottenburg-Wilmersdorf Westend Am Rupenhorn24,1928,Einfamilienhaus,52.51621189999999,13.2600039,True,,Wohngebäude - Einfamilienhaus
Neues Museum,Berlin Bezirk Mitte Mitte Bodestraße1,1841–1859,Bauensemble Museumsinsel Neorenaissance Rekonstruktion Gotik Mezzaningeschoss Südostrisalit Kolonnaden Stuckrelief Pilastern dorischer korinthischer Sandstein gusseisernen gotischen Kassettierung Londoner Welt­aus­stel­lung 1851 ionische Pilaster Kassettendecke Pfettendach Stucco Gipsestrich Karyatiden Pendentifs Pendentifs Museum Museum für Kunst Treppenhalle Berliner Museumsinsel,52.519444,13.406667,True,Mittelalter - Gotik,Öffentliche Gebäude - Palast
Skoda Attendance,Berlin,1995,"Beleuchtung Decke, abgehängt Garderobe Geschäft Modegeschäft Tisch Fußboden: Blech",52.52000659999999,13.404954,True,,
Standbild Kurfürst Friedrichs III.,Berlin Bezirk Charlottenburg-Wilmersdorf Charlottenburg Spandauer Damm,1696,Denkmalschützers Denkmal,52.5190608,13.2906622,True,,Denkmalschutz - Denkmalschutz
"Interbau-Bauteil (Volksbibliothek, Hansabücherei)",Berlin Bezirk Mitte Hansaviertel(Südliches Hansaviertel) Altonaer Straße15,1957,IBA 57 Pergola Bibliothek IBA 1957 (Interbau),52.51720839999999,13.3427768,True,,
Reichsforschungssiedlung Haselhorst,Berlin Bezirk Spandau Haselhorst Gartenfelder Straße;Burscheider Weg,1931–1932,Denkmalschutz 4-geschossig Flachdach Siedlung Wohnanlage Zeile,52.5443918,13.237003,True,,Denkmalschutz - Denkmalschutz
Parzelle im Carré am Gendarmenmarkt,Berlin Bezirk Mitte Mitte Markgrafenstraße35,1994–1996,8-geschossig Blockrandbebauung Bürogebäude Fassadensymmetrie Geschäftshaus Lochfassade Stadthaus Wohnen Staffelgeschoss,52.51279599999999,13.3937831,True,,Wohngebäude - Wohnen
Dorfkirche Reinickendorf,Berlin Bezirk Reinickendorf Reinickendorf(Alt-Reinickendorf) Alt-Reinickendorf 21-22,Ende 15. Jahrhundert,Denkmalschutz Satteldach Walm Kreuzrippengewölbe verputztem Emporen Maßwerk Dachtraufe Kirche Spätgotik Saalkirche,52.57536,13.35237,True,Mittelalter - Gotik,Denkmalschutz - Denkmalschutz
Titania-Palast,Berlin Bezirk Steglitz-Zehlendorf Steglitz Schloßstraße5,1926–1927,Kino Art Déco Foyer Café Denkmalschutz Eckhaus Kino Eckturm,52.4639659,13.3267285,True,,Öffentliche Gebäude - Turm
Villa Brünneck,Berlin Bezirk Steglitz-Zehlendorf Lichterfelde,ca. 1892,Villa,52.4313941,13.3096735,True,,
A+T Projekt am Potsdamer Platz,Berlin Bezirk Mitte Tiergarten Köthener Straße;Stresemannstraße,1996–1999,Bürogebäude Stadtplanung,52.5079994,13.3779627,True,,Öffentliche Gebäude - Stadtplanung
Galeries Lafayette,Berlin Bezirk Mitte Mitte Friedrichstraße76-78;Friedrichstraße@Französische Straße,1991–1995,Kaufhaus Block Form: rund Galerie Glasfassade Kaufhaus Luftraum,52.51442309999999,13.3897795,True,Barock/Rokoko - Barock,
Deutschlandhaus,Berlin Bezirk Charlottenburg-Wilmersdorf Westend Theodor-Heuss-Platz,1931,Denkmalschutz Bürogebäude Lage: Platz Baustil,52.508729,13.2720344,True,,Öffentliche Gebäude - Palast
Königstadt-Terrassen,Berlin Bezirk Pankow Prenzlauer Berg Schönhauser Allee10-11,ab 1993,Bürogebäude Lochfassade,52.5303884,13.4117549,True,,
S-Bahnhof Hackescher Markt,Berlin Bezirk Mitte Mitte Hackescher Markt; Neue Promenade,1878–1882,denkmalgeschützte Viadukt historisierenden Rosettenfenster Oberlicht Wellblech Restaurierungen Bahngebäude Bahnstation S-Bahnverkehr Baustil Neorenaissance,52.5227593,13.4017044,True,Renaissance - Renaissance,Öffentliche Gebäude - Sanitärgebäude
"Stadtvilla an der Rauchstraße, Haus 4",Berlin Bezirk Mitte Tiergarten Thomas-Dehler-Straße1,1983–1985,IBA 1984 (Berlin) Mehrfamilienhaus Postmoderne Solitär Stadthaus,52.5098205,13.347008,True,Moderne - Postmoderne,Wohngebäude - Einfamilienhaus
Grabmal Reimer,Berlin Bezirk Steglitz-Zehlendorf Nikolassee,1921,Grabmal,52.4340941,13.201018,True,,
Wohnhaus Steingroever,Berlin Bezirk Charlottenburg-Wilmersdorf Westend Stallupöner Allee 37,,Einfamilienhaus,52.5042163,13.2316783,True,,Wohngebäude - Einfamilienhaus
Schuhhaus Stiller,Berlin Bezirk Charlottenburg-Wilmersdorf Charlottenburg Wilmersdorfer Straße58,1955–1957,Modegeschäft Geschäftshaus,52.5094081,13.3058592,True,,Gewächshäuser und Gärten - Gewächshaus
Kindertagesstätte Dresdener Straße,Berlin Bezirk Friedrichshain-Kreuzberg Kreuzberg Dresdener Straße128,,IBA 1984 (Berlin) Kindertagesstätte Umnutzung,52.5048341,13.4147263,True,,
SAP-Gebäude,Berlin Bezirk Mitte Mitte Rosenthaler Straße30;Gipsstraße18,bis 2004,"Bürogebäude Eckhaus Glasfassade Ecke, abgerundet",52.5258911,13.4033573,True,,
Wohnen »Am Karlsbad«,Berlin Bezirk Mitte Tiergarten Am Karlsbad8,1986–1987,Blockrandbebauung IBA 1984 (Berlin) Mehrfamilienhaus,52.5039726,13.3705124,True,,Wohngebäude - Einfamilienhaus
Wohnhochhaus auf der Interbau,Berlin Bezirk Mitte Hansaviertel(Südliches Hansaviertel) Bartningallee5,1956–1959,Quadratfenster Hochhaus IBA 1957 (Interbau) Lochfassade Mehrfamilienhaus 17-geschossig,52.5213115,13.3433225,True,,Wohngebäude - Einfamilienhaus
Block E der Stalinallee,Berlin Bezirk Friedrichshain-Kreuzberg Friedrichshain Karl-Marx-Allee105/105a/107/109/111/113/115/117/119/121/123/125/127/129/131 Berlin Bezirk Friedrichshain-Kreuzberg Friedrichshain Karl-Marx-Allee106/108/110/112/114/116/118/120/122/124,1951–1955,Mehrfamilienhaus,52.5194614,13.4244489,True,,Wohngebäude - Einfamilienhaus
Umbau Renaissancetheater,Berlin Bezirk Charlottenburg-Wilmersdorf Charlottenburg Hardenbergstraße6;Knesebeckstraße100,1926–1927,Art-Déco Denkmalschutz Korporationshaus Theater Umbau,52.5166023,13.3041054,True,Historismus - Art déco,Denkmalschutz - Denkmalschutz
Humboldtforum,Berlin Bezirk Mitte Mitte Schloßplatz,2013–2020,Museumsinsel Museumsinsel Wiederaufbau Barocks Museumsinsel Kulturzentrum Museum Wiederaufbau Fassadenraster,52.5180271,13.4004918,True,Barock/Rokoko - Barock,Öffentliche Gebäude - Mausoleum
Bürogebäude »Spreedreieck«,Berlin Bezirk Mitte Mitte Friedrichstraße140,ca. 2006–2009,"Bürogebäude Eckhaus Fassadengliederung, vertikal Form: geschwungen Hochhaus Solitär",52.5211834,13.3879114,True,,
Potsdamer Platz - Sony Center,Berlin Bezirk Mitte Tiergarten Kemperplatz; Neue Potsdamer Straße;Bellevuestraße,1995–2000,Bauensemble Bauensemble Denkmalschutzes Appartement Bürogebäude Geschäfte Hotel Innenhof Lage: Stadtzentrum Mehrfamilienhaus Mischnutzung Textilwerkstoff Überdachung Multiplex-Kino Translozierung Baustil Postmoderne,52.5100253,13.3752261,True,Moderne - Postmoderne,Wohngebäude - Einfamilienhaus
Neugestaltung des Alexanderplatz,Berlin Bezirk Mitte Mitte Alexanderplatz,1929,Blockrandbebauung Stromlinienform Platz Platzgestaltung Stadtplanung Wettbewerb,52.5222559,13.4132262,True,,Öffentliche Gebäude - Stadtplanung
Haus Westend,Berlin Bezirk Charlottenburg-Wilmersdorf Westend Ebereschenallee 16,1907–1908,Einfamilienhaus,52.51488310000001,13.2719442,True,,Wohngebäude - Einfamilienhaus
U-Bahnhof Krumme Lanke,Berlin Bezirk Steglitz-Zehlendorf Zehlendorf Fischerhüttenstraße,1929,Bahnhof Bahnstation,52.441444,13.2427241,True,,Öffentliche Gebäude - Bauhof
Deutsches Theater,Berlin Bezirk Mitte Mitte Schumannstraße12,1849–1850,Casino Theater,52.5238757,13.3817911,True,,
Handelshaus und Wohngebietszentrum Mühlengrund,Berlin Bezirk Lichtenberg Neu-Hohenschönhausen Prerower Platz,1983–1984,Geschäftshaus Mischnutzung,52.5654808,13.5056625,True,,Gewächshäuser und Gärten - Gewächshaus
Wohnblock Havelspitze,Berlin Bezirk Spandau Hakenfelde(Wasserstadt Oberhavel),1996–1997,Block Lage: Fluß Mehrfamilienhaus,52.5803789,13.1729486,True,Barock/Rokoko - Barock,Wohngebäude - Einfamilienhaus
Bürogebäude an der Friedrichstraße,Berlin Bezirk Mitte Mitte Friedrichstraße,1929,Bürogebäude Form: Dreieck Form: geschwungen,52.5147655,13.3891804,True,,
Garagenanlage mit Wohnungen,Berlin Bezirk Pankow Prenzlauer Berg Stubbenkammerstraße 7; Stubbenkammerstraße @ Senefelderstraße,1929–1930,"Eckhaus Garage Tor Ecke, abgerundet",52.54225659999999,13.4235733,True,,
Carillon,Berlin Bezirk Mitte Tiergarten John-Foster-Dulles-Allee,ca. 1985,Granit,52.517648,13.3626726,True,,
Institut für Bergbau und Hüttenwesen,Berlin Bezirk Charlottenburg-Wilmersdorf Charlottenburg Ernst-Reuter-Platz1,1956–1958,,52.5114871,13.3222102,True,,
Bürogebäude der Elektro-Thermit GmbH,Berlin Bezirk Tempelhof-Schöneberg Tempelhof Colditzstraße33,1928,Bürogebäude Fensterband,52.4555757,13.3951411,True,,
Schule,Berlin Bezirk Tempelhof-Schöneberg Tempelhof,1995,Arkadengang Block einhüftig Fassadenschichtung Innenhof Schule Außentreppe Schulzentrum,52.4694927,13.3855997,True,Barock/Rokoko - Barock,
Laubenganghaus an der Wannseebahn,Berlin Bezirk Steglitz-Zehlendorf Lichterfelde Neuchateller Straße 19-20,1930,,52.449403,13.3127029,True,,
DEGEWO-Hochhaus in der Gropiusstadt,Berlin Bezirk Neukölln Gropiusstadt Joachim-Gottschalk-Weg 1,,Hochhaus Mehrfamilienhaus,52.423035,13.4754482,True,,Wohngebäude - Einfamilienhaus
Kaisergalerie,Berlin Bezirk Mitte Mitte Friedrichstraße;Behrenstraße,nach 1871,Neorenaissance Sandstein Cafés Glasdach Passage Fußgängerverkehr,52.5156518,13.3890468,True,Renaissance - Renaissance,Freizeiteinrichtungen - Passage
Wohnhaus,Berlin Bezirk Charlottenburg-Wilmersdorf Westend Am Rupenhorn5,1929,Einfamilienhaus,52.5052889,13.2140046,True,,Wohngebäude - Einfamilienhaus
Gummiwarenfabrik Julius Fromm,Berlin Bezirk Treptow-Köpenick Köpenick Friedrichshagener Straße,ca. 1925,Industriebau Fabrik Internationaler Stil,52.4517117,13.583595,True,Moderne - Internationaler Stil,Industriegebäude - Industriebau
Hamburger Bahnhof,Berlin Bezirk Mitte Tiergarten Invalidenstraße50,1847,Bahnhof Empfangsgebäude Kopfbahnhöfe Restaurant Freitreppe Empfangsgebäude Bahnhof Halle Historismus Kopfbahnhof Baustil,52.52567209999999,13.3659247,True,Historismus - Historismus,Öffentliche Gebäude - Bauhof
Interbau-Bauteil (Wohnhausgruppe),Berlin Bezirk Mitte Hansaviertel(Südliches Hansaviertel) Händelallee33/35/37/39,1957–1958,IBA 1957 (Interbau) Mehrfamilienhaus,52.5213115,13.3433225,True,,Wohngebäude - Einfamilienhaus
Villa Schicke,Berlin Bezirk Tempelhof-Schöneberg Marienfelde Bruno-Möhring-Straße16 (Paralellstraße 8/9),,Einfamilienhaus Jugendstil Villa,52.412478,13.3613976,True,Historismus - Jugendstil,Wohngebäude - Einfamilienhaus
Institut für Pflanzenphysiologie der FU Berlin,Berlin Bezirk Steglitz-Zehlendorf Dahlem Königin-Luise-Straße12-16a,1962–1970,Hochschule für Biologie Institut Universitätsgebäude Spätwerk,52.4580505,13.2907491,True,,
Eierkühlhaus,Berlin Bezirk Friedrichshain-Kreuzberg Friedrichshain Stralauer Allee,1929,vorgehängten Lagerhaus,52.5002373,13.4555848,True,,Gewächshäuser und Gärten - Glashaus
